[
  {
    "timestamp": "2026-04-14T09:00:00Z",
    "agent": "Olaf",
    "action": "metrics-update",
    "description": "Updated weekly metrics scorecard for W16",
    "files": ["public/metrics/metrics.json"]
  },
  {
    "timestamp": "2026-04-13T14:30:00Z",
    "agent": "Olaf",
    "action": "content-publish",
    "description": "Published RAG vs Long Context article",
    "files": ["public/articles/rag-long-context-infrastructure-shift-2026.html", "public/sitemap.xml", "public/feed.xml", "public/llms-full.txt"]
  },
  {
    "timestamp": "2026-04-12T11:00:00Z",
    "agent": "Olaf",
    "action": "seo-optimization",
    "description": "Added canonical URLs to all route head() configs",
    "files": ["src/routes/index.tsx", "src/routes/research.tsx"]
  },
  {
    "timestamp": "2026-04-10T16:45:00Z",
    "agent": "Olaf",
    "action": "geo-optimization",
    "description": "Rewrote llms-full.txt summaries with citation-optimized language",
    "files": ["public/llms-full.txt"]
  },
  {
    "timestamp": "2026-04-09T08:15:00Z",
    "agent": "Olaf",
    "action": "experiment-start",
    "description": "Started A/B test on AI Agent Security Risks meta description",
    "files": ["public/metrics/ab-tests.json"]
  },
  {
    "timestamp": "2026-04-07T10:00:00Z",
    "agent": "Olaf",
    "action": "crawl-check",
    "description": "Verified robots.txt allows all major AI crawlers, updated sitemap",
    "files": ["public/robots.txt", "public/sitemap.xml"]
  }
]